{
  "id": "1982-07-10 - Zig Zag Club, London (V1 AUD)",
  "artist" : "The Sisters Of Mercy",
  "date": "1982-07-10",
  "version": "V99",
  "source": "AUD",
  "generation": "MX",
  "resolution": "16 96",
  "venue": "Zig Zag Club",
  "location": "London",
  "origin": "DJONES",
  "quality": "3-4",
  "setlist": ["ALICE","FLOORSHOW","WATCH","ADRENOCHROME","LIGHTS","1969","SISTER RAY"],
  "notes" : "nice"
}
